{
 "artifact": "10-ranked",
 "schema_version": "3",
 "baseline_sha": "3708648",
 "produced_by": {
  "phase": "10",
  "lane": "rank",
  "model": "none-deterministic-script",
  "effort": "none",
  "nonce_verified": false
 },
 "dropped": [
  {
   "reason": "Light-track plan exists and was adversarially attacked; verdict sound-with-repairs — held out of 09-synthesis until a repair pass applies the named repairs. Re-rank after promotion.",
   "initiative": {
    "initiative_id": "INIT-05-pin-auth-hardening",
    "title": "Tunnel PIN gate: credential types + brute-force resistance",
    "priority": 3,
    "findings": [
     "resilience-hole-0006",
     "primitive-obsession-0010"
    ],
    "decisions": []
   },
   "plan_ref": "docs/plans/2026-07-26-deep-review/07-plans/INIT-05-pin-auth-hardening/opus.json",
   "refutation_ref": "docs/plans/2026-07-26-deep-review/08-refutations/INIT-05-pin-auth-hardening.fable.json"
  },
  {
   "reason": "Light-track plan exists and was adversarially attacked; verdict sound-with-repairs — held out of 09-synthesis until a repair pass applies the named repairs. Re-rank after promotion.",
   "initiative": {
    "initiative_id": "INIT-07-patch-node-identity",
    "title": "Patch node id grammar → typed identity; {drumId,slot} trigger address object",
    "priority": 3,
    "findings": [
     "primitive-obsession-0008",
     "dead-code-0008",
     "data-clumps-0007"
    ],
    "decisions": []
   },
   "plan_ref": "docs/plans/2026-07-26-deep-review/07-plans/INIT-07-patch-node-identity/opus.json",
   "refutation_ref": "docs/plans/2026-07-26-deep-review/08-refutations/INIT-07-patch-node-identity.fable.json"
  },
  {
   "reason": "Light-track plan exists and was adversarially attacked; verdict sound-with-repairs — held out of 09-synthesis until a repair pass applies the named repairs. Re-rank after promotion.",
   "initiative": {
    "initiative_id": "INIT-08-kit-schema-split",
    "title": "kit-schema.ts: split schema surface / migration ladder / defaults",
    "priority": 3,
    "findings": [
     "divergent-change-0005"
    ],
    "decisions": []
   },
   "plan_ref": "docs/plans/2026-07-26-deep-review/07-plans/INIT-08-kit-schema-split/opus.json",
   "refutation_ref": "docs/plans/2026-07-26-deep-review/08-refutations/INIT-08-kit-schema-split.fable.json"
  },
  {
   "reason": "Light-track plan exists and was adversarially attacked; verdict sound-with-repairs — held out of 09-synthesis until a repair pass applies the named repairs. Re-rank after promotion.",
   "initiative": {
    "initiative_id": "INIT-09-ui-component-dedup",
    "title": "Design-system dedup: control contract, inspector chrome, MIDI-learn, ControllerStatusPanel split",
    "priority": 4,
    "findings": [
     "data-clumps-0002",
     "duplicated-code-0010",
     "duplicated-code-0013",
     "duplicated-code-0014",
     "divergent-change-0007",
     "middle-man-0007"
    ],
    "decisions": []
   },
   "plan_ref": "docs/plans/2026-07-26-deep-review/07-plans/INIT-09-ui-component-dedup/opus.json",
   "refutation_ref": "docs/plans/2026-07-26-deep-review/08-refutations/INIT-09-ui-component-dedup.fable.json"
  },
  {
   "reason": "Light-track plan exists and was adversarially attacked; verdict sound-with-repairs — held out of 09-synthesis until a repair pass applies the named repairs. Re-rank after promotion.",
   "initiative": {
    "initiative_id": "INIT-10-test-helper-dedup",
    "title": "Shared test harness: in-memory Storage (×37) + effects test helpers (×6)",
    "priority": 4,
    "findings": [
     "duplicated-code-0001",
     "duplicated-code-0002"
    ],
    "decisions": []
   },
   "plan_ref": "docs/plans/2026-07-26-deep-review/07-plans/INIT-10-test-helper-dedup/opus.json",
   "refutation_ref": "docs/plans/2026-07-26-deep-review/08-refutations/INIT-10-test-helper-dedup.fable.json"
  },
  {
   "reason": "Light-track plan exists and was adversarially attacked; verdict sound-with-repairs — held out of 09-synthesis until a repair pass applies the named repairs. Re-rank after promotion.",
   "initiative": {
    "initiative_id": "INIT-11-telemetry-resilience",
    "title": "Telemetry transport + ingest Worker fault handling",
    "priority": 3,
    "findings": [
     "resilience-hole-0008",
     "resilience-hole-0010"
    ],
    "decisions": []
   },
   "plan_ref": "docs/plans/2026-07-26-deep-review/07-plans/INIT-11-telemetry-resilience/opus.json",
   "refutation_ref": "docs/plans/2026-07-26-deep-review/08-refutations/INIT-11-telemetry-resilience.fable.json"
  },
  {
   "reason": "Light-track plan exists and was adversarially attacked; verdict sound-with-repairs — held out of 09-synthesis until a repair pass applies the named repairs. Re-rank after promotion.",
   "initiative": {
    "initiative_id": "INIT-13-core-surface-trims",
    "title": "Small core API trims (pixel-grid wrappers, graph-integrity throwing form, listCanvasScenes)",
    "priority": 4,
    "findings": [
     "speculative-generality-0011"
    ],
    "decisions": []
   },
   "plan_ref": "docs/plans/2026-07-26-deep-review/07-plans/INIT-13-core-surface-trims/opus.json",
   "refutation_ref": "docs/plans/2026-07-26-deep-review/08-refutations/INIT-13-core-surface-trims.fable.json"
  },
  {
   "reason": "Executed this stint as fix batch-02 (commits a7c46eb + 792cb23, gates green 2968, Phase 6 review non-blocking): mirror field removed at every layer; setKitGlobal survives carrying live kit config.",
   "initiative": {
    "initiative_id": "INIT-12-kit-mirror-removal",
    "title": "Kit mirror removal (decided): client path deletion; server half pending Trent",
    "priority": 3,
    "findings": [
     "dead-code-0002"
    ],
    "decisions": [
     "Trent 2026-07-28: kit mirror is REMOVED by intent (option b of the finding's two fixes). Delete PatchMirrorControl.svelte + unreachable setKitGlobal client path. Trent 2026-07-29: the SERVER half goes too — input-router.ts:186 path, handlers/voice-input.ts:149, handlers/client-message.ts:524, kit-global-forwarding.test.ts, and any protocol setKitGlobal message type."
    ]
   },
   "status_note": "done"
  }
 ],
 "items": [
  {
   "rank": 1,
   "initiative_id": "INIT-03-io-output-resilience",
   "title": "Art-Net/sACN silent-failure closure: error surfacing, ready-flag lifecycle, send seam",
   "criticals": 1,
   "estimated_loc": 660,
   "risk": "high",
   "payoff": "high",
   "depends_on": [],
   "recommended_order_reason": "Closes the live-show-goes-dark silent failure (total error swallow in both output adapters) at the smallest cost on the table (660 LOC, 11 steps); zero protocol/UI change. Highest payoff per unit risk — land first.",
   "plan_ref": "docs/plans/2026-07-26-deep-review/09-synthesis/INIT-03-io-output-resilience.json",
   "status": "ready"
  },
  {
   "rank": 2,
   "initiative_id": "INIT-04-server-runtime-hardening",
   "title": "Server main.ts decomposition + fault containment (render loop, boot, WS liveness)",
   "criticals": 3,
   "estimated_loc": 2500,
   "risk": "high",
   "payoff": "high",
   "depends_on": [],
   "recommended_order_reason": "Resolves 3 criticals including the unprotected render loop (one throw kills output silently) and module-scope boot fragility. Operational resilience second only to INIT-03, and independent of the engine consolidation.",
   "plan_ref": "docs/plans/2026-07-26-deep-review/09-synthesis/INIT-04-server-runtime-hardening.json",
   "status": "ready"
  },
  {
   "rank": 3,
   "initiative_id": "INIT-01-single-render-stack",
   "title": "One render stack: retire legacy engine/, absorb sim.ts voice semantics into core",
   "criticals": 1,
   "estimated_loc": 2450,
   "risk": "high",
   "payoff": "high",
   "depends_on": [],
   "recommended_order_reason": "Removes an entire duplicated subsystem (legacy engine stack + sim.ts voice mirror, ~2450 LOC mostly deletion). Third despite scale because INIT-02/INIT-06 rework overlapping territory (trigger-lab store, core voice types) — landing this first shrinks what they must rebase onto.",
   "plan_ref": "docs/plans/2026-07-26-deep-review/09-synthesis/INIT-01-single-render-stack.json",
   "status": "ready"
  },
  {
   "rank": 4,
   "initiative_id": "INIT-02-store-decomposition",
   "title": "TriggerLab store god-object: real extraction (kill forwarders), web state architecture",
   "criticals": 3,
   "estimated_loc": 2750,
   "risk": "medium",
   "payoff": "medium",
   "depends_on": [],
   "recommended_order_reason": "Resolves 3 criticals in the god-object cluster via a 23-commit strangler with a durable resting state after each. After INIT-01 because both rework trigger-lab; medium risk but the largest estimate (2750 LOC).",
   "plan_ref": "docs/plans/2026-07-26-deep-review/09-synthesis/INIT-02-store-decomposition.json",
   "status": "ready"
  },
  {
   "rank": 5,
   "initiative_id": "INIT-06-graph-node-type-model",
   "title": "GraphNode/NodeKind discriminated-union redesign + voice ctx/param clumps",
   "criticals": 1,
   "estimated_loc": 950,
   "risk": "high",
   "payoff": "medium",
   "depends_on": [],
   "recommended_order_reason": "Buys compiler-enforced totality over the 19-kind node model and fixes the live effect-arm dispatch bug. Last of the five because it touches persisted-show compatibility and benefits from INIT-01 having deleted the legacy consumers of these types.",
   "plan_ref": "docs/plans/2026-07-26-deep-review/09-synthesis/INIT-06-graph-node-type-model.json",
   "status": "ready"
  }
 ]
}
